{
  "schema_version": "hsie-world-reference/0.1",
  "connection_id": "connection:lagoon-nights-to-crossover-portal",
  "source_place_ref": "place:lagoon-nights",
  "source_space_ref": "space:arrival",
  "target_place_ref": "place:crossover-portal",
  "target_space_ref": "space:crossing",
  "connection_type": "PLACE_TRANSITION",
  "direction": "ONE_WAY",
  "status": "ACTIVE",
  "policy_ref": null,
  "version": 1,
  "legacy_refs": [
    "phase15:single-deliberate-post-apocalyptic-entry"
  ]
}
