{
  "schema_version": "hsie-world-reference/0.1",
  "connection_id": "connection:explore-brevard-main-street-to-hsa-arrival",
  "source_place_ref": "place:explore-brevard-main-street",
  "source_space_ref": "space:arrival-plaza",
  "target_place_ref": "place:hsa-arrival-hub",
  "target_space_ref": null,
  "connection_type": "PLACE_TRANSITION",
  "direction": "ONE_WAY",
  "status": "ACTIVE",
  "policy_ref": null,
  "version": 1,
  "legacy_refs": [
    "phase15:main-street-return"
  ]
}
