{
  "schema_version": "hsie-world-reference/0.1",
  "connection_id": "connection:hsa-arrival-to-explore-brevard-main-street",
  "source_place_ref": "place:hsa-arrival-hub",
  "source_space_ref": null,
  "target_place_ref": "place:explore-brevard-main-street",
  "target_space_ref": "space:arrival-plaza",
  "connection_type": "PLACE_TRANSITION",
  "direction": "ONE_WAY",
  "status": "ACTIVE",
  "policy_ref": null,
  "version": 1,
  "legacy_refs": [
    "phase15:explore-brevard-button"
  ]
}
