{
  "schema_version": "hsie-world-reference/0.1",
  "connection_id": "connection:street-001-to-hsa-arrival",
  "source_place_ref": "place:brevard-demo-street",
  "source_space_ref": null,
  "target_place_ref": "place:hsa-arrival-hub",
  "target_space_ref": null,
  "connection_type": "PLACE_TRANSITION",
  "direction": "ONE_WAY",
  "status": "ACTIVE",
  "policy_ref": null,
  "version": 1,
  "legacy_refs": []
}
