{
  "schema_version": "hsie-world-reference/0.1",
  "connection_id": "connection:main-street-to-lagoon-nights",
  "source_place_ref": "place:explore-brevard-main-street",
  "source_space_ref": "space:arrival-plaza",
  "target_place_ref": "place:lagoon-nights",
  "target_space_ref": "space:arrival",
  "connection_type": "PLACE_TRANSITION",
  "direction": "ONE_WAY",
  "status": "ACTIVE",
  "policy_ref": null,
  "version": 1,
  "legacy_refs": [
    "phase15:main-street-to-lagoon-nights"
  ]
}
