{
  "schema_version": "hsie-world-reference/0.1",
  "connection_id": "connection:crossover-portal-to-lagoon-nights",
  "source_place_ref": "place:crossover-portal",
  "source_space_ref": "space:crossing",
  "target_place_ref": "place:lagoon-nights",
  "target_space_ref": "space:arrival",
  "connection_type": "PLACE_TRANSITION",
  "direction": "ONE_WAY",
  "status": "ACTIVE",
  "policy_ref": null,
  "version": 1,
  "legacy_refs": [
    "phase15:crossover-return"
  ]
}
